Author,Date,Rating,ReviewText,ReviewSource,IsLocalGuide,Review Count,PhotosCount,Likes,PhotoCount),PhotoURLs,HasOwnerResponse,OwnerResponse
Thảo Huỳnh,N/A,,"My family member had a stomach ache at 10pm, took him back to the hospital and refused to pay 300k for a quick check-up. He was told to be hospitalized and paid 300k for one night, but refused to go home and demanded to take back the advance payment... so frustrating.",Google,False,2,1,0,0,,False,
Thanh Nguyễn Hoài,N/A,,"First time visiting this hospital, but the quality and service attitude of the staff and doctors are very good. Enthusiastic and dedicated. Thank you to the hospital's medical team.",Google,False,1,0,7,0,,False,
Như TRỊNH,N/A,,"The hospital works slowly, the medical examination process is not in order, elderly patients have to wait for a long time. The medical staff's attitude is poor, they speak rudely and disrespectfully to the patients coming for examination.",Google,False,2,0,3,0,,False,
Quyen Nguyen,N/A,,"Hospitals that pay for money can stay in the pediatrics department for 3 days but it costs 2 million HK, but the reason is that when discharged from the hospital, they list 3 bottles of water. In fact, there are 2 bottles that are paid for. …",Google,False,3,0,3,0,,False,
dung bui,N/A,,"Reputable quality! When you come here, you don't have to worry about having to have money to see a doctor, so you can rest assured. Been visiting for nearly 10 years now 👍🌟🌟🌟🌟🌟 …",Google,False,12,10,11,0,,False,
Mỡ mỡ,N/A,,"The hospital is very . No one to guide. Money is taken very quickly. Whoever gets in first gets examined. If you can't, you'll have to wait forever. Even if you are conscious now, if you don't intervene yourself, it will never be finished. Disappointed . Never been examined again",Google,False,1,0,2,0,,False,
Tinh Nguyen,N/A,,"Obstetrician Dr. An and the nurses. The patient is very enthusiastic and thoughtful, the family thanks the doctor and staff very much",Google,False,1,0,1,0,,False,
Tuyền Trần,N/A,,"The hospital examined her like a qq. She had a fever of 40 degrees. When she came in, she told her to come in and ask for a leave of absence. If she was examined at noon, avoid Dr. Ho Thanh Loi. This doctor hates examinations at noon, everyone.",Google,False,1,0,3,0,,False,
Trang Le,N/A,,"Everyone who comes here to check for insurance from other routes also gets 80%, but actually they don't get it at all. It charges up the price just like not having insurance. Medicine cannot be enjoyed. Toan asked for this medicine to be …",Google,False,2,0,2,0,,False,
Long Lê,N/A,,"When entering inpatient treatment, the medical staff's attention and examination is extremely limited, there is no one to call for fluids, the medical examination hours of the doctors are not fixed or when they want to be examined, their …",Google,True,17,11,0,0,,False,
Mai Nguyễn,N/A,,"I have experienced and really like the team of doctors and nurses in the obstetrics department. Everyone is happy and enthusiastic. The room is also very clean and comfortable. If I have another baby, I will definitely come here.",Google,False,1,0,3,0,,False,
Nguyen Minh Truong,N/A,,"Went for a health check all morning, specifically a routine health check. Went to the administration office to issue VAT but no one was working. Almost 2pm. I give up. Bureaucratic work.",Google,False,2,0,4,0,,False,
Bình Lý,N/A,,Doctors and nurses in the obstetrics department are very enthusiastic and dedicated to patients...,Google,False,1,0,2,0,,False,
ngocvan hoang,N/A,,"It's a bit tiring to wait for a long time, but the doctor is good. Injectable diabetes medicine is not available in the same place, but it is sufficient here, but you have to endure it and not go to the city, which is even more difficult.",Google,False,4,2,8,0,,False,
Hân Ngọc,N/A,,"Prestigious, quality hospital... enthusiastic consulting doctors... cute nurses... 10 stars",Google,False,1,0,1,0,,False,
Hàn Hàn,N/A,,"The hospital defrauded the patient and falsified hospital bills. On the first day of my hospital stay, I did not have insurance and was forced to pay 2 million. After adding insurance, they said 80% of the hospital fee was deducted, but …",Google,False,1,0,12,0,,False,
Thach Alex,N/A,,"I passed the health check and went to work... it's been a while. Please wait according to the medical examination order, then sign your name and you're done. Everyone who wants to be examined should go to Binh An for examination. Less than 1 hour. Here it lasts for 3 hours.🙄🙄🙄🙄 …",Google,True,20,0,3,0,,False,
Linh Khánh,N/A,,"The nurses and doctors of the hospital worked very enthusiastically. But except for the nurse at the registration office, he seemed very uncomfortable with the patient and even spoke softly.",Google,False,3,0,1,0,,False,
Quynh Duong,N/A,,"The service attitude is not good, if you ask the nurse, then you push the responsibility of doing the job and show an unsatisfied attitude towards the patient. If the patient doesn't know how to ask the nurse, then he or she will answer you …",Google,False,1,0,0,0,,False,
Thương Ngô,N/A,,This morning I went to the hospital for a routine health check. I am very satisfied with the hospital's services.,Google,False,1,0,0,0,,False,
Hiền Phong,N/A,,"The hospital is like a gangster, angry and upset with the patients",Google,False,3,2,0,0,,False,
Vinh ngo van,N/A,,"The hospital specializes in finding ways to get money from patients and insurance. Just having a sore throat, the doctor wrote down cough and fever and asked for blood tests, x-rays, etc.",Google,True,31,75,3,0,,False,
My Boy,N/A,,"The hospital is like a bitch. Work is slower than a donkey. Especially the ones sitting there collecting money. 4 of them work and wait for several hours. It's terribly itchy. If the hospital cares, you should watch the camera again to see …",Google,False,2,3,2,0,,False,
Diệp Hoàng,N/A,,"My baby has a fever all day long. Can't call. Droopy person. At 8 p.m., I went to see the doctor and said if I stay, I'll stay or come back tomorrow :)). Half star!",Google,False,3,0,0,0,,False,
Phạm Thị Quỳnh Son,N/A,,"Staff has bad attitude, staff on duty in the emergency resuscitation department at 9:30 a.m. on April 28, 2024",Google,False,3,0,0,0,,False,
Thơ Trần,N/A,,"First time going to An Phu's oriental medicine department, the staff is cheerful and enthusiastic, the cost is cheap, so I went to oriental medicine for a dental check-up.",Google,False,1,0,0,0,,False,
Tiến Phạm,N/A,,"The hospital has spacious facilities, a team of experienced doctors and enthusiastic customer care staff",Google,False,1,0,9,0,,False,
Bé Trâm,N/A,,The evil of stealing other people's money,Google,False,1,0,0,0,,False,
Binh Nguyen,N/A,,The hospital director didn't know what to do upstairs. He waited from 1:30 a.m. to 3 a.m. but could not close the carpentry. Thank you for your dedicated guidance.,Google,True,7,13,1,1,https://lh3.googleusercontent.com/geougc-cs/AB3l90DJF_CXUr9ExPaWokCqHTpKiLRfXWNp5Ve1MpLtgz7kYG5Hn0qKrebmtpCyoQlvSu50gsDXxwmDDwSV_BJD516B1Jyey5iETPBAzysgY5sW7I75PcmMaWbaF_9W6sSTjgeP7-dX=w600-h450-p,False,
Doan Hang,N/A,,"Not satisfied with the service. The doctor gossips. The staff says: if you don't like it, go somewhere else. They always charge extra. Ok. I wish the hospital will be dissolved soon.",Google,False,2,0,5,0,,False,
Vy Thao,N/A,,"10 VND today I went to the doctor here, I feel very good and right now I'm still chatting with the doctor in general.",Google,False,1,0,0,0,,False,
Tuyền Trần,N/A,,I'd rather spend money to see a private doctor. But the doctors here have a poor attitude. I have a fever of 39 degrees and go to the doctor. I've never had my temperature measured. The doctors are like QQ.,Google,False,1,0,0,0,,False,
My Dương,N/A,,"Dear A Tien, we went for a health check-up in the hospital's group on December 30-31. Until now, I kept making appointments and appointments and when did I transfer the MONEY, the company told me to transfer it all to you, I told you to …",Google,False,2,3,7,0,,False,
KhAch,N/A,,Very good,Google,False,1,0,0,0,,False,
Dinh Phuong,N/A,,Examination..the baby was admitted to the hospital..the room was not clean...the baby had a constant fever but kept giving it to reduce the fever..couldn't find the cause..asked the nurse and was told to take care of himself...so why go to the hospital?,Google,False,1,0,0,0,,False,
tuyettrinh do,N/A,,Doctors work with a high sense of responsibility and take very thoughtful and dedicated care of patients,Google,False,2,0,7,0,,False,
Lê Đức,N/A,,"There are very few scandals, but this hospital should not be examined and should not remain weak from service attitude to quality of medical staff.",Google,False,1,0,3,0,,False,
Nguyễn Pin,N/A,,"I've never seen a hospital as bad as this one. It looks big from the outside, it's doing less business than a private clinic. I don't know if anyone has ever been examined in a surgical department. Today, I went for the first time and it …",Google,False,2,0,10,0,,False,
Duyên Nguyễn,N/A,,"So wonderful 🥰
Doctors and nurses are dedicated and thoughtful
This is a great choice for mothers …",Google,False,1,0,2,0,,False,
Vân Luơng,N/A,,"Dentistry forces patients to wait too long
Bad",Google,False,2,0,0,0,,False,
VanKim Thai,N/A,,"Doctor specializes in extorting money from patients. Business is slow and has no professional skills. Nurses have bad attitudes. In general, you should not go to this hospital for examination because losing money cannot solve the problem.",Google,False,2,0,1,0,,False,
0966 Phạm Tiểu Băng,N/A,,"The hospital was opened to do business, not to save lives... The patient was hospitalized for a few days and they also overstated hospital bills and insurance, everything was not transparent. 😡 …",Google,False,2,0,3,0,,False,
Hữu Định,N/A,,"The hospital is very clean, the staff are enthusiastic, the doctors give good advice, okk",Google,False,3,0,0,0,,False,
Minhthanh Nguyen,N/A,,This hospital hires fake doctors and nurses. They do sloppy work and do examinations but don't know what's wrong. I took VK in for 4 hours but couldn't be examined and talked very rudely. I shouldn't go in.,Google,True,25,1,3,0,,False,
Bay Huynh,N/A,,"If you have insurance, it costs 2 million to have a tooth.... I don't understand",Google,False,2,1,0,0,,False,
Đạt Phan,N/A,,There is a family member being treated on the 3rd floor. Visit and notice that the nurses are quite cute and enthusiastic. Nine and a half points.,Google,False,2,1,0,0,,False,
Phan An,N/A,,Sterile gauze bandages sold outside are 60k. Went to the hospital and sold it for 170k,Google,False,1,0,0,0,,False,
Tình Tấn,N/A,,Poor service long wait,Google,False,2,2,0,0,,False,
Tanhao2018 Lam,N/A,,"I just gave birth at the maternity ward of An Phu General Hospital and I gave birth normally so I was able to go home after 3 days. Although it is a provincial hospital, the quality is no different from a city hospital, with a team of …",Google,False,1,0,4,0,,False,
Đức Nguyễn,N/A,,"Hospital is too bad
Doctors and nurses have bad attitudes
Low expertise",Google,False,5,4,2,0,,False,
minhlinh tran,N/A,,"The staff at the registration counter does not respect everyone, has a very poor attitude and work ethic: v
Hospital management staff should correct the personality of their staff, thank you very much!!",Google,False,2,1,2,0,,False,
trong doan van,N/A,,"I had dengue fever and was given a bottle of medicine + 1 pill and then lay down until the afternoon. No questions asked.
It's just a waste of money, guys",Google,False,2,0,0,0,,False,
tâm Thanh,N/A,,"It's bad that the clinic doesn't give advice and when you go to the obstetrics examination, you have to wait a long time for a doctor to see you",Google,False,2,0,1,0,,False,
Huynh Thi Ngoc Anh,N/A,,"Staff have attitude, don't know how to advise, talk nonsense with customers.",Google,False,7,0,2,0,,False,
실버스타,N/A,,"Corona Test Rapid Antigen Test (RAT)
There is 300,000 VND.
There is no wait until the inspection, …",Google,False,27,0,0,0,,False,
khang Le,N/A,,"Obstetrics Department of An Phu Hospital, Doctor Nguyen Tan An and the nurses are very enthusiastic and dedicated, the delivery room is clean and airy, Uncle An is cheerful and humorous. Giving birth here is the brightest choice of a mother's life❤️",Google,False,1,0,1,0,,False,
Trần Bi,N/A,,The hospital is cumbersome. The doctor drew a lot of notes during the examination to add money to the ENT department,Google,True,15,30,3,0,,False,
Kim Cương NT,N/A,,Obstetrician Dr. An is cute and very enthusiastic,Google,False,1,0,0,0,,False,
Nhanh Tran,N/A,,"Very good attitude and way of working, very professional, everyone. From the Doctor to the staff, everyone is great!!! Thank you all!",Google,False,3,0,6,0,,False,
phan tien,N/A,,"Poor expertise, disrespectful working attitude towards patients. Delayed medical examination time,",Google,False,1,0,3,0,,False,
Thúy Hà,N/A,,The hospital is clean. Handsome doctor. Enthusiasm. Very clear and practical advice.,Google,False,1,0,7,0,,False,
Tân Hồ,N/A,,"The hospital diagnosed the illness incorrectly, with a ghost sucking blood from his father",Google,False,1,0,0,0,,False,
Lien Kim,N/A,,"I've heard many companies criticize this hospital, so I don't want to go to this hospital anymore",Google,False,3,0,0,0,,False,
Nam Trương Hữu,N/A,,My child is hospitalized here. The doctors and nurses here provide dedicated care and advice.,Google,False,2,0,5,0,,False,
minh hung dao,N/A,,"I had a broken finger, a deep tear with flesh sticking out. When I went to stitch the wound, the bone x-ray was normal, but the wound was deeply torn. After examining it, the nurse said it needed stitches, but the surgeon didn't look at …",Google,False,2,0,5,0,,False,
Ly Hanh,N/A,,Pricing patients on service prices like International Hospital prescribing drugs outside of insurance,Google,False,1,0,3,0,,False,
tuấn Mỡ,N/A,,There was a second medical examination that took nearly 2 hours,Google,False,1,0,0,0,,False,
Ngọc Hà,N/A,,I hope the hospital will reconsider the working attitude and behavior of the doctors and nurses here :))),Google,False,1,0,0,0,,False,
vanluong trieu,N/A,,The doctor is very enthusiastic and takes good care of him. 10 points for the oriental medicine department.,Google,False,1,0,0,0,,False,
조점호,N/A,,The doctor is rude. I like the nurse. I don't recommend this hospital to anyone. My left wrist still hurts after 3 months. This hospital makes me want to swear. I'm 66 years old in Korean age.,Google,False,3,0,0,0,,False,
Nguyễn Loan,N/A,,Oriental medicine doctors and nurses are enthusiastic and cute. Very effective treatment,Google,False,1,0,0,0,,False,
Phong Ngọc,N/A,,Service ok,Google,False,1,0,0,0,,False,
Thuy Hoang,N/A,,"The price is much higher than other hospitals, the staff has a few enthusiastic people but not much.",Google,True,11,64,3,0,,False,
po pi,N/A,,"The hospital serves patients wholeheartedly, I am very impressed with that hospital",Google,False,1,0,2,0,,False,
Linh Ngo,N/A,,business is not going well,Google,False,4,4,0,0,,False,
nguyen truchang,N/A,,Good service,Google,False,2,6,0,0,,False,
Huong Tran,N/A,,"The patient's treatment is poor, the employee's job is not good, the patient's daily use is more painful, the patient's money may be worse, in general he will not return to the patient's hospital again.",Google,False,1,0,1,0,,False,
Dao Nguyen,N/A,,I would like to thank the doctor and the nurses in the obstetrics department for enthusiastically taking care of my beautiful baby. Thank you very much.,Google,False,1,0,0,0,,False,
My My,N/A,,Enthusiastic doctor.  Full consultation.  Everyone is so cute 😁😁😁 …,Google,False,2,1,1,0,,False,
Leanh Kiet,N/A,,The hospital is so bad. The medical staff was worse than the first and last time,Google,False,1,3,4,1,https://lh3.googleusercontent.com/geougc-cs/AB3l90AfbPze4aqJykeTss4oxGMaQxRbbdvR5DA9Z7VB2Z_XaP4GVkfU0WYYQsjxivHwfIDMlVDM22qfGPyfRZqtOpQTnlI6I9KKLH_Yv8t68WRbNoc5Pp7D31rZ7cIH6kIsHQ-C2XQH=w600-h450-p,False,
Yen Nhi Vo Nguyen,N/A,,Staff attitude,Google,False,2,1,0,0,,False,
Huy Thanh,N/A,,Fast service,Google,False,1,0,0,0,,False,
Phuc Nguyen,N/A,,Nv bad attitude,Google,False,1,0,0,0,,False,
Đức Phan Lê Trường,N/A,,"Waiting to receive the CT scan results, but they didn't give me the results and just sat on the phone",Google,False,5,1,1,0,,False,
Minh Khổng,N/A,,"I examined once and noticed the unclear working style of the doctor on duty at the emergency department on the evening of May 9, 2018.",Google,False,3,2,4,0,,False,
Hằng Trần,N/A,,"Can anyone tell me if it's okay to give birth here at this hospital? , why do I see so many bad reviews?",Google,False,6,0,13,0,,False,
Lam Pham,N/A,,My family and I are very satisfied with the hospital's services.,Google,False,1,0,0,0,,False,
trang giáp thị,N/A,,Dedicated advice,Google,False,1,0,0,0,,False,
cuộc sống người miền núi,N/A,,"Unbelievably bad, the doctor here only knows how to extort money from the patient. His behavior is completely inhumane",Google,True,19,11,3,0,,False,
Chautuan Le,N/A,,"Staff attitude is very bad, work is slow, only collecting money is fast.",Google,False,1,0,0,0,,False,
Klong Phạm,N/A,,10 points,Google,False,1,0,0,0,,False,
Đô Nguyễn,N/A,,"The hospital is so bad, the nurses are unprofessional and talk to each other.",Google,False,2,0,0,0,,False,
son nguyen,N/A,,"The medical team had poor knowledge, they broke their arms and took pictures several times but didn't know the solution and had to go to another hospital!",Google,True,144,28,3,0,,False,
Ba Đỗ,N/A,,Hope the hospital closes soon,Google,True,16,122,0,0,,False,
YÊU NƯỚC Page,N/A,,Need to add online booking,Google,True,38,2,0,0,,False,
Hang Le,N/A,,The team of obstetricians is dedicated and attentive,Google,False,1,0,1,0,,False,
Khoa nguyen,N/A,,Diagnosed with BV,Google,False,4,2,0,0,,False,
The Vuong Nguyen,N/A,,Industry girls go to the doctor,Google,True,399,850,1,2,"https://lh3.googleusercontent.com/geougc-cs/AB3l90Dc4jC0WgY8G-7eiguQpp59nrRokJdKw0zkkwH_ztrnmUib5fax8SGHqSKHl-iTiJ7SvzyQX3tXeEIaS3sJY0N2by-7blHFWMAU8YmEwh0D72leqKPBz4_uDYNIopaB3HxjlOds=w300-h450-p, https://lh3.googleusercontent.com/geougc-cs/AB3l90B-O1QgcHzkv3aok5YJ2SXikJgsCYhp_Ut54xyfTsM56QMN5ndojD7pwa-sNtTzqQ_oYCzY7hM15keYqeTXdvg9QXIQKTA-3KDLOv3Pp09R6w5QfsIx4YzZKMkfmXBU6SjZACCaug=w300-h450-p",False,
Lý Quốc Long,N/A,,The hospital is bad and irresponsible.,Google,False,1,0,0,0,,False,
Phan Tam,N/A,,"The hospital is very bad, slow working, poor attitude, expensive",Google,False,1,0,1,0,,False,
Nhungngoc Truong,N/A,,"The staff is very enthusiastic and thoughtful and gives dedicated guidance. As for the illness, it is being treated",Google,False,1,0,2,0,,False,
Lê Nhiên,N/A,,Hospitals are boring,Google,False,2,0,0,0,,False,
hieu nguyen,N/A,,"If you have a mild illness, you can go in, but if you have a serious illness, you will need to be transferred to the hospital immediately",Google,False,5,0,0,0,,False,
Min Nguyen,N/A,,"As soon as I walked in, I saw a guard who wanted to beat him up like he was in prison... More, I asked k pk.",Google,False,2,5,1,0,,False,
Dinhdong Nguyen,N/A,,No enthusiasm in business... medicine doesn't work... hospital stay 2 million a day... only good at sucking money,Google,False,1,0,3,0,,False,
Lực Võ,N/A,,Great,Google,False,1,0,0,0,,False,
Trí Em Trần,N/A,,How much does a tonsillectomy cost? Doctor,Google,False,1,0,2,0,,False,
tung nguyen,N/A,,"Very good hospital, staff attitude is very friendly",Google,False,1,0,8,0,,False,
Nguyễn Nk,N/A,,"Slow business, poor attitude, no advice or questions. K has a bit of professionalism.",Google,False,254,0,4,0,,False,
Long Vu,N/A,,"An Phu General Hospital. Street 22/12, An Phu, Thuan An, Binh Duong. I see a lot of people giving it bad reviews",Google,True,314,979,2,0,,False,
Phuong Trinh,N/A,,Good service. The doctor was kind. There is also an enthusiastic guide.,Google,False,1,0,8,0,,False,
Nhiên An,N/A,,The doctor is not dedicated to the patient. Brief examination,Google,False,2,0,2,0,,False,
Mỹ linh Trương,N/A,,Doctors take very good care of patients,Google,False,1,0,4,0,,False,
Trần Tài,N/A,,"The hospital is clean, airy, quiet, suitable for everyone.",Google,True,8,8,4,0,,False,
Luc ho minh,N/A,,Service attitude and sense of responsibility are very poor,Google,True,31,224,0,0,,False,
Băng Trần,N/A,,Service ok,Google,False,1,0,0,0,,False,
Tâm Nguyễn,N/A,,The doctors provide dedicated care and a team of good doctors.,Google,False,1,0,3,0,,False,
Lan Vũ,N/A,,"Very expensive, stitching a baby's nose costs 265,000",Google,False,1,0,1,0,,False,
Nguyễn Thành Luân,N/A,,"The hospital is clean, airy, and has enthusiastic staff",Google,True,70,113,2,1,https://lh3.googleusercontent.com/geougc-cs/AB3l90BvsoFW64Zj6F4hHzKI8ibin1QkE1Ar8Q-6BjFvXlhrPuDkcepjoIRj34b2XveBTy3al4036WEngf-H7ZmLvQoiZKoBI7hgnF36uQw_9iloMHsVXjqN1dRCyc-C4AMm7-mtK59_=w600-h450-p,False,
Minh Vương Nguyễn,N/A,,"New equipment, enthusiastic staff. The thing is that it's private so it's a bit expensive but acceptable.",Google,True,62,28,0,0,,False,
GIA LAI TEAM,N/A,,Rough examination. Very unpleasant attitude.,Google,False,3,0,0,0,,False,
Tôm Tôm,N/A,,The hospital does business irresponsibly and is not punctual.,Google,False,10,1,2,0,,False,
Nikko Đặng,N/A,,This place has pregnancy check-ups and cesarean sections.,Google,True,145,337,3,0,,False,
Già Bảy,N/A,,There is covid -19. Contain and examine patients,Google,False,199,0,1,0,,False,
Tiến Phạm Minh,N/A,,Hospitals scammed patients during the epidemic season,Google,True,47,15,3,0,,False,
Duy Thanh,N/A,,The fee is too expensive but the service is normal.  Is it nice and tight?,Google,False,7,2,0,0,,False,
Ngọc Lý,N/A,,Lack of professionalism and price is twice as high as other hospitals,Google,False,2,0,1,0,,False,
Hiền Huỳnh Đức,N/A,,"If it's serious, then go to a bigger hospital",Google,True,75,3,0,0,,False,
Quynh Anh Nguyen,N/A,,"Friendly staff, doctors close to patients",Google,False,6,6,6,0,,False,
Quân Trần Công,N/A,,This hospital is irresponsible and not transparent in its work,Google,False,1,0,0,0,,False,
Huynh Toan,N/A,,Fraud. Noisy phone call advertising. Good service requires no advertising.,Google,True,41,78,3,0,,False,
Thanh Tú Lương,N/A,,"Dedicated team of doctors and staff, very reassuring",Google,False,55,40,4,0,,False,
Đặng Diễm,N/A,,Good service,Google,False,1,0,0,0,,False,
Oanh Ngọc,N/A,,Enthusiastic team of doctors and nurses - very good service quality.,Google,False,2,0,3,0,,False,
Phan Phúc Quang,N/A,,"Full facilities
Good quality
Professional
Cheap price",Google,True,42,6,8,0,,False,
Tú Vi,N/A,,"All I have to do is get an invoice, but it never arrives",Google,False,1,0,1,0,,False,
Hưng Nguyễn,N/A,,I advise everyone not to come here for a checkup,Google,False,3,2,1,0,,False,
Duy Vo,N/A,,An Phu Hospital,Google,True,175,143,2,4,"https://lh3.googleusercontent.com/geougc-cs/AB3l90Ciuh7mitvysW6Vw4KCYH5tjkkGQSv-DtCCtHeYFK7mQZQCl9sOJP-vKjw1_Y12-O_6C-rxJcEOXHn5_I8mNdZkaYxZVNlh8WOZaDLWXW2-IiLk8iwrl08179TTPu-RmtNGnbE8=w300-h225-p, https://lh3.googleusercontent.com/geougc-cs/AB3l90An_11aByA2ynAelaVxJ9jx8amDZdLVp6j1ZdXvAFbjYvZta3dFj6rZTLm9dNFREJNyiA0LUQAjbXCOEd2fIfg5420SNQcvNpehuJvm4PAtXWrqI8JUtnKjBAY2Uo3n0sKeWIYAgA=w300-h225-p, https://lh3.googleusercontent.com/geougc-cs/AB3l90AXbGfSz77KvVOnenuT4JgzN4WFjGkYAWrfgEENwR1tnFBI_aw5yIFxBBIWvx4qqOIhKzznMB-2aMMrkD7Zm8ZFPja_5n0MyaG0ki0lZylV8eE06M_uHDF1dRNZHp14cQk0i0E=w300-h225-p, https://lh3.googleusercontent.com/geougc-cs/AB3l90A80yJnpp_tRsAVJawlqQKQbuW2GyHR5MtqXxmdWO0p1NdDC-QzHdGAUdVTG3mFJMs2OX_mnx9OqgBZ1S_CLUOcoErC_VWYZMi6oi_DswR5gFb5N91EGjs6-OJkuSwYrSeBnOrR=w300-h225-p",False,
nvn vlog vlos,N/A,,"I'm tired and have trouble breathing, but I'm not sick",Google,False,3,0,0,0,,False,
Huy Nguyễn,N/A,,I advise everyone not to come here for a checkup,Google,True,67,197,2,0,,False,
Vy Thuỳ,N/A,,Doctor Hung is handsome and handsome,Google,False,1,0,0,0,,False,
Quang Minh,N/A,,Good,Google,False,1,0,0,0,,False,
Ngọc Bích,N/A,,"Doctors, nurses and staff are very friendly 😇 …",Google,True,9,23,0,0,,False,
Tu Ngo,N/A,,Private clinics are also okay,Google,True,28,15,0,0,,False,
Sơn Thuỷ Nguyễn,N/A,,Located in a place with convenient transportation and densely populated area,Google,True,431,942,1,0,,False,
Thu Hien,N/A,,Professional and dedicated staff. Very wonderful 😍😍 …,Google,False,1,0,1,0,,False,
anh hoàng,N/A,,"Poor service attitude, especially in the x-ray room",Google,False,4,6,0,0,,False,
Thu Hiền Trần,N/A,,Doctor Hoai is cute and enthusiastic.,Google,False,1,0,1,0,,False,
Gdeuue Ueueu,N/A,,Very bad experience,Google,False,1,0,0,0,,False,
Nguyễn Hồ Nam,N/A,,Bad,Google,False,1,0,1,0,,False,
Thanh Tâm Phan,N/A,,Dedicated doctor and polite staff,Google,False,3,2,1,0,,False,
Phat Hoang,N/A,,"Enthusiastic service, dedicated to patients",Google,True,18,23,0,0,,False,
nghia le,N/A,,Bossy attitude. Poor service. Byebye,Google,False,1,0,1,0,,False,
Thinga Bui,N/A,,Good,Google,False,1,0,0,0,,False,
Daisuke Kambe,N/A,,"Too slow, too long",Google,False,4,0,1,0,,False,
KenRon Official,N/A,,"What can I say other than it's terrible
It's really terrible",Google,False,1,0,1,0,,False,
song Thạo bui,N/A,,"Damn it, making money off of other people's suffering",Google,False,1,0,2,0,,False,
Nguyễn Thái,N/A,,The hospital is not quite finished yet.,Google,True,34,421,1,0,,False,
hữu Văn,N/A,,Is this a normal birth or a cesarean section?,Google,False,1,0,0,0,,False,
