Author,Date,Rating,ReviewText,ReviewSource,IsLocalGuide,Review Count,PhotosCount,Likes,PhotoCount),PhotoURLs,HasOwnerResponse,OwnerResponse
huynh tuyet hoa,N/A,,"Last week, my family went to the hospital for pink eye; as soon as we arrived at the Eye Department of My Phuoc Hospital, we saw a lot of patients waiting like our family. There were so many patients that both the doctors and nurses had to …",Google,False,1,1,5,0,,True,Thank you for coming to health care at MPH. Wishing you lots of health and happiness
Nguyên Thảo,N/A,,Can I ask if the hospital where I give birth has a refrigerator?,Google,False,2,0,0,0,,True,"Yes, the hospital has rooms fully equipped with refrigerators, TVs, and many other amenities for pregnant women."
Linh Chí,N/A,,"Good service, attentive staff",Google,False,1,0,0,0,,False,
Phương Trần,N/A,,"I had a check-up at clinic 14 at MP hospital and was thoroughly examined by Dr. Hai and guided by the nurses, who spoke gently and cheerfully.
Besides, the Cashier counter's attitude seemed unpleasant and grumpy",Google,False,1,1,1,1,https://lh3.googleusercontent.com/geougc-cs/AB3l90AOCXzotqbrxbR7QK_cBt9geQn5bbqUgthFmDb_z1ZYQLPcoyx-p9HMqlIXMTll2hLp4zz62JJPGoBeLR5HGvaf2RgN5_8GVGu3iO5zOLiv2Df0xYdBN6ecKDFBAbMuG1Iek83rjA=w600-h450-p,True,"Thank you for trusting the medical examination and providing comments to the hospital. The hospital will consider and take measures to improve. To update medical service information, please follow the Hospital's official fanpage: … More"
Vo thi Hue,N/A,,"BVMP staff are enthusiastic and friendly consultants, explaining carefully the information that people come to see, the doctors and staff are also dedicated. I have been examined many times at the hospital, every time is ok.",Google,False,1,0,0,0,,True,"Thank you, I wish you all the best"
Kiều Đinh Thị Thúy,N/A,,"Too bad. It's not about the quality of medical examination and treatment, it's about the guard's attitude. Also",Google,False,1,0,0,0,,True,"The hospital is looking forward to receiving specific information via Hotline 0888015777, we are very sorry for your bad experience when coming to the hospital for health care. The hospital will investigate and find solutions to improve the service better and better. Wish you always healthy and happy!"
Trần Thị Thúy,N/A,,"I just went to the trauma surgery department last week and found the doctors and nurses attentive and attentive, the hospital clean and airy, very satisfied.",Google,False,1,0,0,0,,True,"Thank you for coming to MPH for health care. The hospital is constantly improving its services to serve patients/customers quickly and effectively. To update information on medical services, please follow the hospital's official fanpage: … More"
Cường Huỳnh quốc,N/A,,"I don't understand how you guys are working, the attitude of the obstetricians on Sunday morning, July 7th, was extremely negative. It affected my wife's spirit. The best working teams should be clear on paper. If you post this, everyone …",Google,False,1,0,0,0,,True,"The hospital is looking forward to receiving specific information via Hotline 0888015777, we are very sorry for your bad experience when coming to the hospital for health care. The hospital will investigate and find solutions to improve the service better and better. Wish you always healthy and happy!"
chienD13E,N/A,,"I took my wife to a prenatal checkup here, the doctor was very dedicated, dedicated, and thoughtful. My wife has seen Dr. Huyen Dieu twice now. Every time I go for a check-up, Dr. Huyen Dieu gives me careful, thoughtful advice, and very …",Google,False,4,0,0,0,,True,"Thank you for coming to health care at MPH, wish you good health!"
Tiệp Nguyễn,N/A,,"Doctor Bui Duc An is deaf or something. My mother went to the doctor complaining of right chest pain many times but he wrote down the diagnosis as left chest pain, while at that time my mother had an X-ray and it was found that she had a …",Google,False,1,1,6,1,https://lh3.googleusercontent.com/geougc-cs/AB3l90B1BaAdcHaI6O5bVaFCQZVR5iRSewcNm9ptZtuy2DeWqFQdVemP2cjqj2Ccfiuol9prfwNqlT08pvyRyl8ByOX-NbxyFIRVmuCPu6XbtrZhZCuTgvQqDr2KUJ_lPmHG-MMqoYLI=w600-h450-p,False,
Ngoc Phuong Thai Thi,N/A,,"Normal service, hospital fees are quite high. When I left the hospital, I had to wait until 4:00 p.m. to pay, but when I said payment, the billing staff had an attitude, said the billing time was over, and said to come back tomorrow. When …",Google,False,22,46,1,0,,True,"Thank you for your comments, I am very sorry for your bad experience when coming to the hospital for health care. Please call Hotline 0888015777 or send us the patient information, which department you are being treated in so that the … More"
冠清ho,N/A,,The location is a bit far away and the environment is empty. I came here to get vaccinated. It is very ventilated and feels good and the speed is very fast.,Google,True,615,782,1,2,"https://lh3.googleusercontent.com/geougc-cs/AB3l90DgNhmEdwxUiIlT_2A3Cc_dOpK1c_QriXo2xIakP2XqO3vhn3brDm2FqzC4P66hwSDqp6R0ljKwjEA7SG2nLElK_pm6S5KTNGL15_GVv2cWgSdWly4uprmAr8BsWkuFyRx4yvNeCQ=w300-h450-p, https://lh3.googleusercontent.com/geougc-cs/AB3l90AUzet7_FncwHAa1k8WPH6GUot5eNfRjEmPmcYe75FJ0WswL3mo-8Gi-QqVfHYRozW2O-B9zC3awEuim4F_xhU40KhUyi7Z6UolnMK7s2leZEzqwKiQQF9v3tItyj_GwKs1oIIC=w300-h450-p",False,
Ái Trân Nguyễn,N/A,,"The cashier in the service area talked to customers impolitely, directed others without enthusiasm and spoke rudely. I didn't know the way to the emergency room. She spoke so softly that I didn't hear her. I asked again and she said, ""I …",Google,False,2,0,1,0,,True,"The hospital is looking forward to receiving specific information via Hotline 0888015777, we are very sorry for your bad experience when coming to the hospital for health care. The hospital will investigate and find solutions to improve the service better and better. Wish you always healthy and happy!"
Luc Tran,N/A,,"Lobby staff, attentive, cheerful",Google,False,1,0,0,0,,False,
Thùy Hương Trần,N/A,,"My friend had her pregnancy checked here, the doctor's name is HUYNH CAM HUONG. The doctor's attitude during the examination was extremely indifferent, I don't understand how such a bad personality and attitude can still stand in the ranks …",Google,False,4,8,9,0,,True,"Hello, the hospital has noted your comments/feedback and will have a solution according to hospital regulations. We are very sorry for the bad experience when you came to the hospital for health care. Hello, can you provide more information … More"
Ann Nguyen,N/A,,"sat and waited for a long time even though I came in early, finished eating and drinking but still no results (about 2 and a half hours), no service at all but all kinds of extra charges, presented a bill that was shocking to read (a …",Google,False,4,2,1,0,,True,"The hospital is looking forward to receiving specific information via Hotline 0888015777, we are very sorry for your bad experience when coming to the hospital for health care. The hospital will investigate and find solutions to improve the service better and better. Wish you always healthy and happy!"
Huyen Van,N/A,,"When examined, the service examination consultant will charge an additional 50k, but in fact this is a regular examination area (room number 9) not a service examination area (this area charges 100k), the purpose of getting an additional …",Google,False,2,0,4,0,,True,"Hello, can you provide more information about the issues you are not satisfied with via email customerservice.mph@gmail.com or call the Customer Service Hotline 0888015777 so that the hospital can give specific advice or have better improvement measures? Thank you very much."
Liễu Tiêu,N/A,,Very satisfied with MP hospital's examination and treatment services,Google,False,1,1,0,1,https://lh3.googleusercontent.com/geougc-cs/AB3l90CKrK1yURPfb8brCsBAwRcUsqJ1GtQRHBxKdrUs09xGacDt0jjlA_ZbdnwhzgveiqdSFeLx6TOXjMz1XiivG4zgIN-VSUpaElVvNIo-z-mg4RhyOk8Sl482CPFAU7-Pk8-rtec=w600-h450-p,True,"Thank you for coming to MPH for health care. To update information on medical services, please follow the Hospital's official fanpage: https://www.facebook.com/benhvienmyphuoc/ … More"
Quế Nguyệt,N/A,,"I was examined and stayed in the hospital here for 3 days. The doctors and midwives were very enthusiastic, caring, and fun.",Google,False,2,0,0,0,,True,"Thank you for coming to health care at MPH. To update medical service information, please follow the Hospital's official fanpage: https://www.facebook.com/benhvienmyphuoc/ … More"
nguyen tung,N/A,,"Current hospital equipment, enthusiastic staff, delicious food. Write in a hurry and don't upload pictures.",Google,False,3,0,0,0,,True,Thank you for coming to the hospital for health care. Wishing you and your family good health and peace!
my quynh dang,N/A,,"Good service.
Modern equipment.
The team of doctors and nurses are dedicated, cheerful, and thoughtful. …",Google,False,3,0,0,0,,True,"Thank you for coming to health care at MPH. To update medical service information, please follow the Hospital's official fanpage: https://www.facebook.com/benhvienmyphuoc/ … More"
MINH NGUYỄN VĂN,N/A,,"- As soon as I entered the hospital, it was clean, airy, and spacious.
One time I went to the hospital for a medical examination but it wasn't even lunch break. It was still during medical examination hours but the staff didn't …",Google,False,3,3,2,0,,True,"Thank you for your comments, very sorry for your poor experience when getting health care at the Hospital. The hospital will re-investigate and find solutions to improve the service even better. Wishing you always healthy and happy!"
TUYEN DO,N/A,,I came back from abroad and went to the hospital for a general health check-up. I was very satisfied with the hospital's service. The consulting staff was enthusiastic and cheerful. The doctor examined me ok.,Google,False,1,0,1,0,,True,"Thank you for coming to MPH for health care. To update information on medical services, please follow the Hospital's official fanpage: https://www.facebook.com/benhvienmyphuoc/ … More"
Quyên Trịnh,N/A,,"My suggestion is, in the minor surgery room, the day I went to cut the corners of the ingrown toenails, the bed sheets were still stained with fresh blood from another patient that hadn't been changed yet, but I still told the new patient …",Google,False,1,0,2,0,,True,The Hospital would like to acknowledge your comments and apologize for your poor experience when receiving health care at the Hospital. The hospital will re-investigate and find solutions to improve the service even better. Wishing you always healthy and happy!
minh tran,N/A,,"Good service, the doctors and ophthalmology nurses enthusiastically guided the nurses and spoke very sweetly. I saw that they were very tired at noon but still tried to examine all my children, thank you very much! We wish the ophthalmology department of My Phuoc hospital good health to serve patients.",Google,False,1,0,5,0,,True,Thank you for coming to MPH for health care. Wishing you good health and happiness.
An Lu,N/A,,"This afternoon, I checked in to room number 6 for a mouth examination. When I entered the room, I found it strange that the doctor was wearing a blue uniform like a hospital janitor. I asked briefly and was told to go to room number 8. When …",Google,True,30,23,1,0,,True,"Hello, we are very sorry for the bad experience you encountered. Please provide additional patient information and examination time in the message or Hotline 0888 015 777 so that the hospital can check again and if there is any, the hospital will take corrective measures. Thank you, wish you good health!"
Tín Nguyễn,N/A,,"There are many patients, not to mention, but there are very few patients but still have to wait a long time, and everyone knows why it takes so long.",Google,False,1,0,0,0,,True,"The hospital is looking forward to receiving specific information via Hotline 0888015777, we are very sorry for your bad experience when coming to the hospital for health care. The hospital will investigate and find solutions to improve the service better and better. Wish you always healthy and happy!"
minh khang phan vũ,N/A,,The hospital's ophthalmology department works very diligently; The doctors and nurses are all very enthusiastic; dedicated to patients; nurses speak softly; approachable. I have been examined many times at the Ophthalmology Department and each time I feel very satisfied,Google,False,1,0,5,0,,True,Thank you for coming to health care at MPH. Wishing you lots of health and happiness
Bang Tran,N/A,,"Good service, all orthopedic nurses, enthusiastic, fun, dedicated",Google,True,85,24,0,0,,False,
Thảo Hoàng,N/A,,"Coming for a general medical examination at My Phuoc hospital. Even though there are many patients, the consultants are very thorough and handle things quickly.",Google,False,2,2,1,0,,True,"Thank you for coming to MPH for health care. To update information on medical services, please follow the Hospital's official fanpage: https://www.facebook.com/benhvienmyphuoc/ … More"
Tri LeMinh,N/A,,"The hospital is well equipped with modern equipment and books, ensuring security and order.",Google,True,23,102,2,3,"https://lh3.googleusercontent.com/geougc-cs/AB3l90DSi-4AjuV-A_hMTezDL0KgNmLbbV5y6I7uR_SUT2557nNLNwdOMhCKD0CeXq08SGNp8HjB6U4CB8FzgLFG63CMscePunncahGy48ZBP9dglC_LEyWC6z9v9avGJae5JAMzqf4M=w300-h450-p, https://lh3.googleusercontent.com/geougc-cs/AB3l90Cqr7OAE0u6yY2WAyXibydwkuoi1J1yxrZ_KWz38MswDvyrxqU-WyFeHTn2w7XJIQurxAIzGohdkPTMX7B84kFYtv9CglDKEdogIq8oTMvZ_QycE5Vh_Jre4LdPdeLRlLDB1yiQ=w300-h225-p, https://lh3.googleusercontent.com/geougc-cs/AB3l90D4F960pkns21YGG0mY_kok0MV2czXw6CPbMiGkw_Q1zHAlwJXxQQweGvb1IAcK1uDwQdtpls6QzeFZlVoqR10FuZXP78YNdb-89HorpOgpHUP_HDgmDIXVOVMswvmOmW5nNPf1=w300-h225-p",False,
Sơn Phạm,N/A,,Medical examination and treatment are very good.,Google,False,3,2,0,1,https://lh3.googleusercontent.com/geougc-cs/AB3l90DmMWFSlZ-AQZ5ri84jRnEb-1COcMjQAsMcDumf1-SNSnzydOEk-G0oSw7Ufa77SqNtqrWJQEtvXcD7Y9AGDccofSQ9RkHxt22838LF9JRriaNpQF2Sj2MeapFTGAqaR9NC9eHmpQ=w600-h450-p,True,"Thank you for coming to health care at MPH. To update medical service information, please follow the Hospital's official fanpage: https://www.facebook.com/benhvienmyphuoc/ … More"
Đức Le,N/A,,"I have a family member who is treated in the trauma surgery department, area A
The doctors and nurses all took care of me thoroughly and thoughtfully, I felt very satisfied …",Google,False,1,0,0,0,,True,"Thank you for coming to MPH for health care. The hospital is constantly improving its services to serve patients/customers quickly and effectively. To update information on medical services, please follow the hospital's official fanpage: … More"
Hương Thu,N/A,,"I went in to register for a quick examination, went to get an MRI in room 12, I was number 11, but when number 10 finished taking the scan, the medical staff asked person number 12 to come in first, while I waited for an hour, at home with a small child, I felt it was unfair here.",Google,True,24,2,1,0,,True,The hospital is looking forward to receiving your specific information via text message or Hotline 0888015777. We are very sorry for your bad experience when coming to the hospital for health care. The hospital will investigate and find solutions to improve the service better and better. Wishing you good health and happiness!
Nè :v Duy,N/A,,The nurse steals the examination fee and forces the patient to transfer the money to a personal account,Google,False,2,0,1,0,,False,
Thiên Đặng Quốc,N/A,,"The hospital is beautiful, airy, and has modern equipment",Google,False,1,14,1,3,"https://lh3.googleusercontent.com/geougc-cs/AB3l90CCJWqNfIrHqZANoVZotHqee2oVukTBdxUun6tLEl7FOoGhEMT2YjvwLRRiyhwHVTsKeSydsjgILMTsHzBXaxlnA6Nu8TIphHgECpKR6BprVDAndv8N0tCzfHP3sd-ygXp5NpYe=w300-h450-p, https://lh3.googleusercontent.com/geougc-cs/AB3l90Ac-499jjIS5up030E7RbMBooefeQFPuyHi6s0c65cxe-M8qi0X4g29uIMFNXGIZdhIVrStrgkjvVV9y6At3wAG5uj9UsmwZhzyjsveDWlgeYTHronUjGFCV75l6NrJ8TpUKuen=w300-h225-p, https://lh3.googleusercontent.com/geougc-cs/AB3l90CFQ-nw2yLZB2K5ZtgRUVoU6qjhEuFEJXhgD8QAhtoYOplTA-DS-7vPkFeytJQHf8NRBeDDqRgkvfgbzwpzthzWox5897vFSSoAXI3uOp8g6nuxNiieUn7RaGs-bZi3xiBRJrRD=w300-h225-p",False,
Như Ý Nguyễn,N/A,,"The doctors and nurses in the pediatric department are cute, and the hospital receives attentive care, with a friendly visiting team.",Google,False,5,1,0,0,,True,"Thank you for coming to MPH for health care. The hospital is constantly improving its services to serve patients/customers quickly and effectively. To update information on medical services, please follow the hospital's official fanpage: … More"
Yen Nguyễn,N/A,,"Today I came for a general medical check-up, and I felt very satisfied with the service from the staff and the team of nurses and doctors. I will refer my relatives to the hospital for a health check-up.",Google,False,1,0,0,0,,True,Thank you for coming to MPH for health care. Wishing you good health and happiness.
Phùng Nguyễn,N/A,,I went for a general check-up at the hospital and was very satisfied with the way the nurses and doctors were received. Everyone is cute,Google,False,1,0,0,0,,True,"Thank you for coming to health care at MPH. To update medical service information, please follow the Hospital's official fanpage: https://www.facebook.com/benhvienmyphuoc/ … More"
Hoa Phan,N/A,,First visit very satisfied,Google,False,1,1,0,0,,True,"Thank you for coming to health care at MPH. To update medical service information, please follow the Hospital's official fanpage: https://www.facebook.com/benhvienmyphuoc/ … More"
KIM ANH TRÀ,N/A,,"The hospital is clean and beautiful, the doctors are enthusiastic and thoughtful, but when it's time to be discharged, the patient's medical record is wrong and the patient's patient is lost.",Google,False,1,0,0,0,,True,"Hello, thank you for taking the time to evaluate and give feedback to the hospital. We are very sorry for the bad experience you encountered. Please provide more information about the patient and the time of examination in the message or … More"
Anh Thu Nguyen,N/A,,I went to have my child's eyes examined and the nurses and doctors were very kind in examining and instructing my child's eye care. I am very grateful to the doctors and nurses of My Phuoc Ophthalmology Department.,Google,False,3,0,5,0,,True,Thank you for coming to MPH for health care. Wishing you good health and happiness.
gà tổng hợp,N/A,,The service is good..normal birth minus insurance is about 5 to 6 million..but vip sex is different hihi,Google,True,9,0,0,0,,True,"Thank you for coming to health care at MPH. To update medical service information, please follow the Hospital's official fanpage: https://www.facebook.com/benhvienmyphuoc/ … More"
Hiếu Văn,N/A,,I have been tested many times at the Customer Service department. I am very satisfied. I received careful advice and the results were delivered on time. The staff is attentive and attentive. Today I went in for another examination and am waiting for the results.,Google,False,1,0,0,0,,True,Thank you for coming to MPH for health care. Wishing you good health and happiness.
Chú 13,N/A,,Waiting for medical examination from 9:00 am to 10:30 am but still unable to come in for examination,Google,False,2,0,0,0,,True,"Hello, I am very sorry if you have had a bad experience. Please provide more specific information about the incident via Hotline 0888 015 777 so that the hospital can check and fix it if it is true as you reported. Wishing you and your family always happy."
Hải Đăng Nguyễn,N/A,,"Professional health examination service and the doctor is very cute, dedicated and thoughtful, instructing each area to do and examining thoroughly.",Google,False,2,0,0,0,,True,"Thank you for coming to MPH for health care. The hospital is constantly improving its services to serve patients/customers quickly and effectively. To update information on medical services, please follow the hospital's official fanpage: … More"
Truc Hong,N/A,,"General health check-up is very satisfactory, the family comes for a medical check-up every time it is ok.",Google,False,1,0,0,0,,True,"Thank you for coming to health care at MPH. To update medical service information, please follow the Hospital's official fanpage: https://www.facebook.com/benhvienmyphuoc/ … More"
Dũng Linh,N/A,,"The first time the hospital was examined, it was very good. The Customer Service Center is thoughtful, dedicated, friendly, and the doctor examines thoroughly.",Google,False,1,3,0,0,,True,"Thank you for coming to health care at MPH. To update medical service information, please follow the Hospital's official fanpage: https://www.facebook.com/benhvienmyphuoc/ … More"
Duong Lam,N/A,,"General examination is very good, dedicated consultation.",Google,False,1,0,0,0,,False,
LD Thiên Sứ,N/A,,"When I went to surgery clinic 14, the doctor gave me gentle and dedicated advice. Indicated for surgery, go to the hospital for careful consultation",Google,False,2,0,0,0,,True,"Thank you, wish you good health and peace."
Thanh Ngọc,N/A,,Good service and enthusiastic support,Google,False,1,1,0,0,,True,Thank you. Wishing you and your family good health.
Nguyen Hang,N/A,,"In the whole big hospital, the pediatrics department only has one old male doctor, accompanied by an assistant... Why do you think there's no place to sit and wait when you enter? But there was one person who visited. Too poor. Rated 0 ⭐ for quality",Google,False,2,0,4,0,,False,
Van Le,N/A,,"Everything is ok, but the people at the cashier counter in the pediatric department are not enthusiastic when patients ask questions, they just don't ask clearly, they worry about many things, everyone's face looks uncomfortable, I hope the hospital will improve",Google,False,1,0,0,0,,True,The Hospital would like to acknowledge your comments and apologize for your poor experience when receiving health care at the Hospital. The hospital will re-investigate and find solutions to improve the service even better. Wishing you always healthy and happy!
Nguyet Pham,N/A,,"Obstetrics department services are very good. When giving birth, there is a pelvic floor steamer and massage head. I really enjoy giving birth. Everyone should come.",Google,False,1,0,0,0,,True,"Thank you for coming to health care at MPH. To update medical service information, please follow the Hospital's official fanpage: https://www.facebook.com/benhvienmyphuoc/ … More"
Em Nâu TV,N/A,,"The hospital is huge but does business like crap.
The initial examination was diagnosed with pneumonia and admitted to the hospital. The next day, an x-ray showed bronchitis. After being injected with …",Google,False,2,0,7,0,,False,
Minh Phú Đoàn,N/A,,All ground floor cashiers have bad attitude towards customers when paying by card or bank transfer. We suggest that the hospital should consider and handle this problem!,Google,False,3,0,1,0,,True,"Thank you for your feedback, we are very sorry for your bad experience when coming to the hospital for health care. The hospital will review and find solutions to improve the service better and better. Wish you always healthy and happy!"
Thi bich tien Le,N/A,,Medical examination and treatment services at BVMP are very good.,Google,False,1,0,0,0,,False,
Tuyen Bui,N/A,,The medical staff in the men's room gave birth to a very small fetus. The design looks like a warehouse.,Google,False,1,0,1,0,,True,The Hospital would like to receive your feedback via Hotline 0888015777. We are very sorry for your poor experience when receiving health care at the Hospital. The hospital will re-investigate and find solutions to improve the service even better. Wishing you always healthy and happy!
Thuan Tran,N/A,,"Went for a health check-up and paid but asked to show which room was next to the other room, and where the other room was. Said to go for a check-up according to Circular 14, asked to go around 30 times, then asked ""Hey, are you doing a …",Google,False,4,3,4,0,,True,"Hello, I am very sorry for the bad experience when you came to the hospital for health care. Hello, can you provide more information about the issues you are not satisfied with via email customerservice.mph@gmail.com or call the Customer … More"
Thi Nguyen,N/A,,I came for a routine test and flu shot and received dedicated advice and guidance from the doctors and medical staff. The hospital is spacious and clean.,Google,False,2,1,3,0,,True,Thank you very much! Wish you good health.
Thao Thao,N/A,,The hospital is terrible at extorting money from patients. I have health insurance but I'm not allowed to use it. I have to force the extraction service to be quoted 2.5 million. Or I have to be hospitalized to get health insurance. …,Google,False,4,2,3,0,,True,"Hello, I am very sorry for the bad experience when you came to the hospital for health care. Hello, can you provide more information about the issues you are not satisfied with via email customerservice.mph@gmail.com or call the Customer … More"
Lê Tùng BĐS Bình Dương (Người Đó Đây),N/A,,"Okay, good quality machines but the medical team is not excellent",Google,True,75,364,3,3,"https://lh3.googleusercontent.com/geougc-cs/AB3l90BOPh3i-f_6tBPTDsvgI2WXm_gtYPudNlLG4P3xuV9x-lo2yw2OOh_RWiD6-1DS-MtmQzuHF4RxQwLqp5MQI0R-DoVj98-5tPtbqgspFVhFMnsb-YUfdnp3BMwKvbS6v_7qrWk=w300-h450-p, https://lh3.googleusercontent.com/geougc-cs/AB3l90CWXuvWmho9U6rW-MbX7sjCwl_tRbrv7wn9WVfUTC2EZsPOBOOpKBJEXbU3paD6DfoJtaDM8WfJvSuU3FH8rp9EuQkYU6DvqQBjD3xmvK-C5zZyiggne0z5DchMbA8Hs7_LfhAm=w300-h225-p, https://lh3.googleusercontent.com/geougc-cs/AB3l90Bc03Shy40s2OU_K66YpQgKs1BhpoO2DNqMSmunwqSGrJJjtW1AI2Eo5hqQuxsGtBbeehNelFgMJPUsRVTdrX1gZD7fptypb38kS_N2h4Wy6QcwfmYEbqzj0-_CihztvaxdVoU0=w300-h225-p",False,
