Author,Date,Rating,ReviewText,ReviewSource,IsLocalGuide,Review Count,PhotosCount,Likes,PhotoCount),PhotoURLs,HasOwnerResponse,OwnerResponse
hot hot hot vlog,N/A,,"When I went to have an abdominal ultrasound check-up, the service price was not covered by the health insurance. The wait for the examination was long while there were few people doing the examination, the service got worse and worse... I …",Google,False,1,0,5,0,,True,"Thank you for your comments, we are very sorry for your bad experience when coming to the hospital for health care. Please text or call hotline 0888015777 to provide more information, the hospital will investigate and have solutions to improve the service better and better. Wish you always healthy and happy!"
Fuji Saitou,N/A,,"The hospital is very clean, I always see the cleaning ladies cleaning continuously, the staff is friendly, the doctors examine carefully.",Google,False,1,0,3,0,,True,Thank you for coming to MPH for health care. The hospital is constantly improving its services to better care for patients/customers. Wishing you good health and happiness.
Thái “Bình” Dương,N/A,,"Work is slow, there are few patients and there is a long wait, from reception to examination. The doctor's capacity is weak and the doctor's attitude is bossy. Ben Cat doesn't have a real hospital, so I don't know how to get to the city.",Google,False,9,1,9,0,,False,
Hóa Trần,N/A,,"The first time I came to the hospital for examination and admission, I was very satisfied. The staff and doctors gave careful and dedicated advice.",Google,False,2,0,1,0,,True,Thank you for coming to health care at MPH. Wishing you lots of health and happiness
Bắc Vũ Thị,N/A,,"Giving birth at American General Hospital, the room is very clean, the doctors, nurses, and staff are very dedicated and thoughtful.",Google,False,1,0,2,0,,True,"Thank you for trusting and using medical services at MPH. Wishing you and your baby good health, peace, and a happy family."
Khôi Đăng,N/A,,"Why do you think that at 9:00 a.m. every few nights, 2 or 3 of my relatives visit me and don't let me sleep in my room, so I can just let me wait outside and send me home 🙂 …",Google,False,1,0,0,0,,True,"Hello, to ensure the safety and quietness of inpatients, according to regulations, each patient is only allowed one caregiver. The hospital allows family members to visit until 9:00 p.m. After that, only the registered caregiver can stay. We hope you understand."
Tuan Tran,N/A,,"First general health check-up, enthusiastic and thoughtful staff and doctors.",Google,False,2,0,0,0,,True,Thank you for coming to MPH for health care. The hospital is constantly improving its services to better care for patients/customers. Wishing you good health and happiness.
Loan Thúy,N/A,,"What kind of doctor or nurse speaks rudely and has such a bad attitude towards patients. If a doctor has no ethics, then think about it. Rude.",Google,False,1,0,2,0,,True,"Hello, I am very sorry for the bad experience when you came to the hospital for health care. Hello, can you provide more information about the issues you are not satisfied with via email customerservice.mph@gmail.com or call the Customer … More"
tin dang hc,N/A,,"Spacious, clean.  Good service.  However, the examination fee is 50k plus tests (a bit overuse of unnecessary tests, other hospitals don't do these tests). That's the examination fee, not including medicine, it's about 300k (with health insurance).",Google,True,17,125,0,0,,True,"Hello, I am very sorry for the bad experience when you came to the hospital for health care. Hello, can you provide more information about the issues you are not satisfied with via email customerservice.mph@gmail.com or call the Customer … More"
Son Luong,N/A,,"I was very satisfied when I was admitted to the hospital. The medical staff did the treatment very carefully and enthusiastically, and the doctor examined me well.",Google,False,1,0,0,0,,True,"Thank you for coming to MPH for health care. To update information on medical services, please follow the Hospital's official fanpage: https://www.facebook.com/benhvienmyphuoc/ … More"
Review bds Binh Duong,N/A,,The hospital examined him and found nothing. staff are not welcoming. The doctor did a cursory examination. She went for a prenatal check-up at Becamxe hospital a week ago and was 2kg8. Then she had an ultrasound at this hospital and the weight was 2kg5. It only takes 1 minute to measure the fetal heart rate... so superficial.,Google,True,15,98,4,0,,False,
tuyet tieu,N/A,,"Hospital pharmacy Service staff dispenses medicine thoroughly, thoughtfully, and cutely.",Google,False,1,0,0,0,,True,"Thank you for coming to health care at MPH. To update medical service information, please follow the Hospital's official fanpage: https://www.facebook.com/benhvienmyphuoc/ … More"
Nhiên Ho,N/A,,"I am very satisfied with the PVI DVTS examination service guaranteed at BVMP. I just finished the examination, I would like to thank the hospital.",Google,False,2,0,0,0,,True,Thank you for coming to MPH for health care. Wishing you good health and happiness.
Hang Ngo,N/A,,"Giving birth at the Obstetrics Department was very satisfying, the doctor and nurses took care of me warmly, patiently, and thoughtfully.",Google,False,1,0,0,0,,True,"Thank you for coming to health care at MPH. To update medical service information, please follow the Hospital's official fanpage: https://www.facebook.com/benhvienmyphuoc/ … More"
vo thai yên,N/A,,"At the beginning of the year, I went to the hospital for a DVTS examination. I was very satisfied with everything about the hospital. Wishing the hospital a happy new year.",Google,False,1,0,0,0,,True,"Thank you, wish you good health."
tính Võ TV,N/A,,"Everything is expensive, I have insurance and staying for 1 week costs 5 million.",Google,False,3,0,0,0,,True,The hospital is looking forward to receiving specific information via Hotline 0888015777 so that staff can support and answer you. Wishing you good health and happiness!
Phương Nhâm,N/A,,"After 2 years of visiting the hospital, I am very satisfied with the hospital's service.",Google,False,1,0,0,0,,True,"Thank you for coming to health care at MPH. To update medical service information, please follow the Hospital's official fanpage: https://www.facebook.com/benhvienmyphuoc/ … More"
Ngoan Tu,N/A,,"All the nurses and doctors were good and spoke very politely to the patients. Only the doctor who examined the obstetrics department in room number 2 cursed the patient, bullied the patient, and quickly examined the patient for a …",Google,False,1,0,10,0,,False,
Khánh Phạm,N/A,,"This hospital is so boring, charging patients with covid 10 million. Meanwhile, the quarantine areas provide free treatment, each person tested 4-6 times at a cost of nearly 800k, here we care for everyone.",Google,True,7,35,7,0,,False,
Trong Haquang,N/A,,"Medical examination and treatment are very good, blood disease medicine works well, enthusiastic staff.",Google,False,1,0,0,0,,True,"Thank you for coming to health care at MPH. To update medical service information, please follow the Hospital's official fanpage: https://www.facebook.com/benhvienmyphuoc/ … More"
caphe duahau,N/A,,"On the hospital website, there are instructions for declaring via Ncovi to save time on screening. When I got to the screening area 1-2, I was asked to write a paper. I asked why the website said I could declare through Ncovi, but they only …",Google,True,33,5,2,0,,False,
My Đặng,N/A,,"What kind of hospital has a doctor with an attitude that shows no signs of looking down on others? People who don't know the way just talk about it
We also pay for medical examination, but we don't ask the temple to do that. The hospital did not have any polite wishes",Google,False,1,0,2,0,,False,
Len Trần,N/A,,"For the first time, I was very satisfied with the general and in-depth medical examination package, received enthusiastic and happy consultation.",Google,False,1,0,0,0,,True,Thank you for coming to MPH for health care. Wishing you good health and happiness.
Tuan Hoang,N/A,,"I'm quite frustrated so I came here to talk and need correction from the hospital staff.
My grandmother is old and cannot drive or take a bus to see her doctor herself. …",Google,False,1,0,9,0,,False,
Trinh Phuong,N/A,,Check carefully and enthusiastically.,Google,False,4,0,0,0,,False,
LÊ Thùy Dương,N/A,,The vitanimex company's medical examination was satisfied. Nv is scared of good HD,Google,False,1,0,0,0,,False,
Ngọc Lê,N/A,,The examination department is clean and the medical staff is dedicated,Google,False,1,0,0,0,,False,
Su Zenny,N/A,,"First and last time... the cost is high and the way the nurses talk is poor... the service is not as good as the insurance check-up at a Saigon hospital. If there were 0 stars, I would vote for this hospital 0 stars.",Google,False,9,4,0,0,,True,"Hello, thank you for coming to MPH for health care. Can you provide more information about the issues you are not satisfied with via email customerservice.mph@gmail.com or call the Customer Service Hotline 0888015777 so that the hospital can understand and have better measures to improve? Thank you very much."
Mini Tp,N/A,,"At the emergency room, the nurse sterilized the wound but it was as if she was doing laundry. I said it was painful but still didn't ease up. She scolded me, ""I told you to endure the pain a bit"" but oh my god, she scrubbed the wound like …",Google,False,9,1,4,0,,True,"Hello, I am very sorry for the bad experience when you came to the hospital for health care. Hello, can you provide more information about the issues you are not satisfied with via email customerservice.mph@gmail.com or call the Customer … More"
Nhung Ngô,N/A,,Thank you BVMP very much. I took my mother there for examination and treatment. Now she has recovered and is back to normal.,Google,False,1,0,0,0,,True,Thank you for coming to MPH for health care. The hospital is constantly improving its services to better care for patients/customers. Wishing you good health and happiness.
A mui Lieu,N/A,,"The consultants are dedicated and supportive, the general examination package is very satisfying, I have almost finished the examination.",Google,False,1,0,1,0,,True,"Thank you for coming to MPH for health care. To update information on medical services, please follow the Hospital's official fanpage: https://www.facebook.com/benhvienmyphuoc/ … More"
Lan Le,N/A,,"Dedicated and thoughtful service, staff receive service carefully when patients ask",Google,False,1,0,0,0,,True,"Thank you for coming to health care at MPH. To update medical service information, please follow the Hospital's official fanpage: https://www.facebook.com/benhvienmyphuoc/ … More"
Trí Bùi,N/A,,"When you are admitted to the hospital, you will be informed and understood by the doctor and the treatment room. Really like this DVD.",Google,False,1,0,0,0,,True,"Thank you for coming to MPH for health care. To update information on medical services, please follow the Hospital's official fanpage: https://www.facebook.com/benhvienmyphuoc/ … More"
Bảy Bé,N/A,,"Being hospitalized, participating in patient council activities, and consulting doctors is very useful.",Google,False,1,0,0,0,,True,"Thank you for coming to health care at MPH. To update medical service information, please follow the Hospital's official fanpage: https://www.facebook.com/benhvienmyphuoc/ … More"
Hoàng Hà Nội,N/A,,"The hospital is clean, has health insurance but the examination and waiting time is quite long, the hospital room is also very clean but the cost is quite high. In general, for examination of minor or common diseases, you can refer to it.",Google,True,117,308,1,2,"https://lh3.googleusercontent.com/geougc-cs/AB3l90DNT7iMY9wugduWRbhzqGjpx2rhOIQlm9DbfBd88YSPUhbAo_jyxJ0_jr9r2u1ljEHRzxJEKzb8fu5PYc6feYSRa_wsr8wt-w1OLXqPdY1dQ5EKLPy3TG8Jj5LuUvLaeqehPxiB=w300-h450-p, https://lh3.googleusercontent.com/geougc-cs/AB3l90Bi3R2jgfbyeXyXW7r5DNBbSK8znkPJ8n8bt8ev5z1AM03s23hq-FC_gA7u292zAR3aeNt9O5MAB-uGbE7l-T_dbVJMC4kfnL4YW-Qj7NrZUsMejEAQ8i_qm1INhFQCFG8gqgM=w300-h450-p",False,
Thaiduong Nguyen,N/A,,"Before going in for the examination, I asked the staff here if they would take biopsy samples: nv: answered yes. I paid 50k for me to go to clinic number 14, CTCH department …",Google,False,10,2,3,1,https://lh3.googleusercontent.com/geougc-cs/AB3l90B0e_TnVettz80b0sbrlY146LwYRBAuoLVHZiI83WXGLrD_1wktYhbkNiWkhRxZcCc9jCddYfdXISBZUZqwf2IZNoKHYySAe5PKpg9CpvhRB8O57lm01oX8joYEeiutrNYsD3TXGA=w600-h450-p,False,
Trúc Anh Nguyen,N/A,,"I've never seen a hospital that hasn't been examined for 4 hours since the number was picked up, even though it's not as frequent as other hospitals.",Google,True,11,6,1,1,https://lh3.googleusercontent.com/geougc-cs/AB3l90BVPAUtl051EOhEIq9owuuqf_hrtnZvzildIjw2XWn9oU9e2O9TWlluwWNXuxekUOyFQBoQmk_GbtEyrxEyaVIzf9I8lz5nviH-uYnZGPOF4chm-JfG53ZBKHvdekLLRlsb8YJbjA=w600-h450-p,True,"Thank you for your comments, we are very sorry for your bad experience when coming to the hospital for health care. Please text or call hotline 0888015777 to provide more information, the hospital will investigate and have solutions to improve the service better and better. Wish you always healthy and happy!"
Lộc Cao,N/A,,"Came to see the price of 4 packs, the doctor was very satisfied.",Google,False,1,0,0,0,,True,"Thank you for coming to health care at MPH. To update medical service information, please follow the Hospital's official fanpage: https://www.facebook.com/benhvienmyphuoc/ … More"
TrầnThạch An,N/A,,Ignore the serial number and blame the patient. Service is too poor,Google,False,2,0,1,0,,True,"Hello, I am very sorry if you have had a bad experience. Please provide more specific information about the incident via Hotline 0888 015 777 so that the hospital can check and fix it if it is true as you reported. Wishing you and your family always happy."
Hac Luc,N/A,,"Just been on vacation for 1 week, the doctor, nurse, cashier, security guard, and cleaning lady are very enthusiastic, cheerful, and clean.
The thing is, the supermarket canteen's prices are too high",Google,False,3,0,0,0,,True,"Thank you for coming to health care at MPH. To update medical service information, please follow the Hospital's official fanpage: https://www.facebook.com/benhvienmyphuoc/ … More"
Trâm Lê,N/A,,My child was examined and hospitalized at My Phuoc hospital and I am very satisfied. Dedicated hospital staff and doctors.,Google,False,1,0,0,0,,True,Thank you for coming to MPH for health care. Wishing you good health and happiness.
Lieu Nguyen,N/A,,The doctor and nurse in the examination department are enthusiastic and attentive.,Google,False,1,0,0,0,,True,"Thank you for coming to health care at MPH. To update medical service information, please follow the Hospital's official fanpage: https://www.facebook.com/benhvienmyphuoc/ … More"
Vũ Duy Long,N/A,,"Go for a health insurance check-up and collect service fees. When it comes time for feedback, it won't be resolved. Oh, it's a star. Fraud?",Google,False,1,0,3,0,,True,"Hello, thank you for coming to MPH for health care. Can you provide more information about the issues you are not satisfied with via email customerservice.mph@gmail.com or call the Customer Service Hotline 0888015777 so that the hospital can understand and have better measures to improve? Thank you very much."
Bich Thuy Tran,N/A,,"Avoid this hospital, from the stage of receiving documents, medical examination to collecting fees, in terms of expertise, it cannot be evaluated, but in terms of attitude, it is very bossy, especially the fee collection department when …",Google,False,3,1,4,0,,True,"The hospital looks forward to receiving your comments via Hotline 0888015777, we are very sorry for your bad experience when coming to the hospital for health care. The hospital will investigate and find solutions to improve the service better and better. Wish you always healthy and happy!"
Nguyễn Thanh Sang,N/A,,"Nurses in the trauma surgery department provide enthusiastic guidance, attentive care, light-hearted conversation, and good service",Google,False,1,0,0,0,,True,"Thank you for coming to MPH for health care. The hospital is constantly improving its services to serve patients/customers quickly and effectively. To update information on medical services, please follow the hospital's official fanpage: … More"
Quynh Nguyen,N/A,,Emergency treatment at the hospital for 1 day. Can't pay for insurance at the hospital. Until the insurance requires an emergency medical certificate. Went to the hospital to ask for an emergency medical certificate. They made all kinds of …,Google,False,2,0,2,0,,False,
Xuân Nguyễn Thị Khắc,N/A,,"Doctor Bao examines thoroughly, is caring, thoughtful, and compassionate staff.",Google,False,1,0,0,0,,True,"Thank you for coming to health care at MPH. To update medical service information, please follow the Hospital's official fanpage: https://www.facebook.com/benhvienmyphuoc/ … More"
Hà Nguyễn,N/A,,"I just had endoscopic surgery for a deviated septum at the ENT department. I found the team of doctors and nurses here to be quite enthusiastic, the hospital is clean, and the prices are reasonable.",Google,False,1,0,0,0,,True,"Thank you very much, wish you good health and happiness"
vanh ý phan Phan,N/A,,"Attentive, good customer service. Good health check-up.",Google,False,1,0,0,0,,True,"Thank you for coming to health care at MPH. To update medical service information, please follow the Hospital's official fanpage: https://www.facebook.com/benhvienmyphuoc/ … More"
Dũng Ha,N/A,,I am being treated at the general surgery department. The nurses and doctors are friendly and enthusiastic,Google,False,1,0,0,0,,True,Thank you very much. The Department of General Surgery is very pleased to receive your review as a motivation for the hospital to make more efforts.
Vân Ánh,N/A,,"Every time I come to BVMP, I see the nurses cleaning up very well.",Google,False,1,2,0,2,"https://lh3.googleusercontent.com/geougc-cs/AB3l90AxPDC2docdqnOkUE-9HPd8xsmKff8MZUbC1bNMF_XFMOyJWrhZNBfvH8HtnuF8BPX2Gfh0AJr98xqOp7EX0sl_3XUczPl-S_CYu5AhEzGsgWrMZ_qAQLOPhtjtVJkJNCBNKCRxSA=w300-h450-p, https://lh3.googleusercontent.com/geougc-cs/AB3l90CQoCjW_5AfOlTITeWPxrpqVc8qoh4vAjFb61m7hImN8lk9ljuOJ_gCwL2V3-sCCB5iMKyAuSwc288bSxWbByzS8kUWWcT9h5OF3LCJTuKUYdYOhftCnjLGSDi_rjeEzLES9lo=w300-h450-p",True,Thank you for coming to MPH for health care. The hospital is constantly improving its services to better care for patients/customers. Wishing you good health and happiness.
Thihue Dang,N/A,,"In the morning, I went to the prenatal checkup and asked questions before I could just rush home. The examination was not thorough, many questions were asked in detail but could not be answered.",Google,False,1,0,0,0,,True,"Hello, thank you for coming to MPH for health care. Can you provide more information about the issues you are not satisfied with via email customerservice.mph@gmail.com or call the Customer Service Hotline 0888015777 so that the hospital can understand and have better measures to improve? Thank you very much."
Trần Hiếu,N/A,,Pregnancy check-up. Always threatening to test continuously. Makes the patient feel confused. So I go out for a check-up. The baby is healthy and nothing is wrong. I will never come back to this hospital again.,Google,True,35,10,4,0,,False,
Oanh Kiều,N/A,,"On Sunday, I took my child for a tetanus shot. The nurse prescribed the wrong dose for her child to be vaccinated, but the vaccination lady discovered that she didn't know what would happen after the injection (a 6 year old child was given …",Google,False,1,0,5,0,,False,
Lê Thị Hồng Ngọc,N/A,,"The clinic is clean, the quality is quite good. However, there are some bad elements. I really don't like the attitude of a doctor in the obstetrics department. I have been there several times and found the same attitude.",Google,False,5,11,4,0,,False,
Linh Nguyễn Bá,N/A,,"Everyone is very reluctant to come to this hospital. If you can go somewhere else, you should go. Here, from the doctors and nurses, the attitude is lacking, even the nurses are uneducated. Prices are expensive, patient practices are all …",Google,False,1,32,4,0,,False,
Cường Lê,N/A,,"The female counter who received patients from the dental and maxillofacial department acted irresponsibly...went away to do her own thing, forcing the patient to complete the treatment without getting a paper to pay and complete the procedure...waited for more than an hour without receiving a response.",Google,False,1,0,4,0,,False,
Nguyễn Trung Nguyên,N/A,,Good and spacious facilities,Google,True,193,179,0,4,"https://lh3.googleusercontent.com/geougc-cs/AB3l90D2zbtabP44cdSL6en7_NWzmgB14yL4kgViuEIeLWymosX-8jGR8x3TSGcSVOtthkAa8cywaWtR-u9MPa83jWj1y-sqbEvyldvpvCyJwY-5LtjVPgYJCpkNyK6qq01ARNBR5cseGg=w300-h225-p, https://lh3.googleusercontent.com/geougc-cs/AB3l90AI8_tHwoqm3hEWj5YlxZsRmiCMbR6kVN0NHAa5PHpXCNP6tst-fmXaTNvqgyX9fh_GbADKiL_1FAGcCAwM_0N_gF-59YiiPw8185owluK1WY771LQ9N6sqC167jlr7YeBJPctakQ=w300-h225-p, https://lh3.googleusercontent.com/geougc-cs/AB3l90Atv6vQp451Q-McubSb7TBinMdu2BqdcwyYRkjQCR9dLu9GwO1GFqpfyKzboACRDfgXCRdsxNxGYDwmAASXL_vm5VnpPJs-3kVMZg7PLG6f53-Mg96dk8uOr3GseGUmrXSjgfeksQ=w300-h225-p, https://lh3.googleusercontent.com/geougc-cs/AB3l90BZYrDSh-15eRS3-2PmbqyTbhgEeJb9ChtKoamWajySsukLAGfBCypPVcNAdcL5fhHfPSJlkkwVZBK-BzwaQAqsMjK7VG1kWrB38ZnaFYYnmCbPR0rFyOVVb3MCIDZ_OWs-eFBX=w300-h225-p",False,
THUAN TRAN,N/A,,Can I ask if the hospital is open late at night?,Google,False,3,0,0,0,,True,The emergency department operates 24/7
Thùy Trang Nguyễn Thị,N/A,,"Some individuals are disrespectful to patients and are not dedicated. As a highly educated person, please behave as you were taught.",Google,False,1,0,3,0,,True,"Hello, I am very sorry for the bad experience when you came to the hospital for health care. Hello, can you provide more information about the issues you are not satisfied with via email customerservice.mph@gmail.com or call the Customer … More"
yenlinh Dinhthi,N/A,,Satisfied with medical service,Google,False,2,1,0,1,https://lh3.googleusercontent.com/geougc-cs/AB3l90BVD9o7D_dGwYiAOD4_6jYmnype6ZNZIAbhUIBl5_hu7fnSdCnxGWkodqpikDtp13GAg_L__wLX4SBS_1_5AxEjU6Lt_NpwTg44KS9VItlHb1ebeWCP5QrE3tBS6NbvLMqd0eg=w600-h450-p,True,"Thank you for coming to health care at MPH. To update medical service information, please follow the Hospital's official fanpage: https://www.facebook.com/benhvienmyphuoc/ … More"
Nguyen Tri,N/A,,What kind of hospital is it that has insurance to pay for? I just went to Binh Duong. I don't know where to get the medicine. I asked but the cashier really bullied me and lost my sympathy.,Google,False,1,0,8,0,,False,
Thanh Pham,N/A,,"Nowadays, it's okay to go to any hospital. If you have the money, the service is the best. I have consulted the reviews of all the major hospitals in Saigon. There are good and bad reviews. Even Columbia International Hospital in Binh …",Google,False,6,4,5,0,,False,
Kiệt Võ Tuấn,N/A,,High service but low quality in return. Some doctors have quite negative attitudes during work.,Google,True,54,185,2,0,,False,
Manh The,N/A,,"Temporarily okay. Clean, modern equipment.",Google,True,372,556,0,1,https://lh3.googleusercontent.com/geougc-cs/AB3l90BBkyXvO74OKUfeC53WoVkK4VQGHLOlPZqywL5yHDjOmoZ2A49YHQWt1ohYJ4mUKDtH-N3W3LONxJQE94vOY7UhuC7Fslzgy4mEVD90VEUBvKKZbONcggb_Lnos52FR5whb-IF8=w600-h450-p,False,
Nhiều Nguyễn,N/A,,"The doctor is very good, the staff consulted and gave a quote before the surgery.",Google,False,1,0,0,0,,True,Thank you for coming to MPH for health care. Wishing you good health and happiness.
Quốc Quân,N/A,,"very bad, attitude of wanting to take advantage of patients, these members should be removed from the medical staff, very dissatisfied with the cashier of this hospital",Google,False,1,0,7,0,,False,
Linh Nguyễn (Huy Măng non),N/A,,"The hospital has a beautiful green space, the consulting staff and doctors are very caring, dedicated and attentive.",Google,False,1,0,1,0,,True,"Thank you very much, wish you good health and happiness"
Nhật Nguyễn,N/A,,"Going to the doctor, I have to buy medicine outside, which is a bit expensive. Sometimes when I ask for a few days off due to illness, everything is difficult... Time consuming.",Google,False,1,0,0,0,,True,"Hello, thank you for coming to MPH for health care. Can you provide more information about the issues you are not satisfied with via email customerservice.mph@gmail.com or call the Customer Service Hotline 0888015777 so that the hospital can understand and have better measures to improve? Thank you very much."
hoatiep trinh,N/A,,Happy and enthusiastic staff,Google,False,1,0,0,0,,True,Thank you. Wishing you and your family good health.
Ninh hảo La,N/A,,"At BVMP, you respond to messages from the BV page very enthusiastically. After hours, you still respond 24/7. Very satisfied.",Google,False,1,0,0,0,,True,"Thank you for coming to health care at MPH. To update medical service information, please follow the Hospital's official fanpage: https://www.facebook.com/benhvienmyphuoc/ … More"
Nguyễn Vy,N/A,,Too bad,Google,False,5,0,0,0,,True,"Hello, the hospital would like you to provide more specific information via Hotline 0888 015 777 so that the hospital has specific information to improve service quality better and better. Best regards !"
